{
  "capabilities": [
    "portable_manifest_discovery",
    "synthetic_offline_video_smoke",
    "shared_secret_refs_env_keyring",
    "video_material_manifest",
    "local_asr_candidate_planning",
    "evidence_bundle",
    "review_bundle",
    "mcp_stdio"
  ],
  "contract_refs": [
    {
      "bundle_id": "local-tools-portable-contracts",
      "bundle_path": "contracts/portable/v1/portable-contract-bundle.v1.json",
      "bundle_version": "1.0.0",
      "contract_id": "material-manifest.v1",
      "distribution_repository": "https://github.com/lightcoloror/research-content-production"
    },
    {
      "bundle_id": "local-tools-portable-contracts",
      "bundle_path": "contracts/portable/v1/portable-contract-bundle.v1.json",
      "bundle_version": "1.0.0",
      "contract_id": "evidence-bundle.v1",
      "distribution_repository": "https://github.com/lightcoloror/research-content-production"
    },
    {
      "bundle_id": "local-tools-portable-contracts",
      "bundle_path": "contracts/portable/v1/portable-contract-bundle.v1.json",
      "bundle_version": "1.0.0",
      "contract_id": "content-brief.v1",
      "distribution_repository": "https://github.com/lightcoloror/research-content-production"
    },
    {
      "bundle_id": "local-tools-portable-contracts",
      "bundle_path": "contracts/portable/v1/portable-contract-bundle.v1.json",
      "bundle_version": "1.0.0",
      "contract_id": "review-packet.v1",
      "distribution_repository": "https://github.com/lightcoloror/research-content-production"
    },
    {
      "bundle_id": "local-tools-portable-contracts",
      "bundle_path": "contracts/portable/v1/portable-contract-bundle.v1.json",
      "bundle_version": "1.0.0",
      "contract_id": "service-profile.v1",
      "distribution_repository": "https://github.com/lightcoloror/research-content-production"
    },
    {
      "bundle_id": "local-tools-portable-contracts",
      "bundle_path": "contracts/portable/v1/portable-contract-bundle.v1.json",
      "bundle_version": "1.0.0",
      "contract_id": "closure_run.v1",
      "distribution_repository": "https://github.com/lightcoloror/research-content-production"
    },
    {
      "bundle_id": "local-tools-portable-contracts",
      "bundle_path": "contracts/portable/v1/portable-contract-bundle.v1.json",
      "bundle_version": "1.0.0",
      "contract_id": "local-tool-event.v1",
      "distribution_repository": "https://github.com/lightcoloror/research-content-production"
    }
  ],
  "description": "Clone-portable VKP discovery, synthetic offline video-evidence smoke, material manifests, review artifacts, CLI, and MCP. Metadata never authorizes execution.",
  "executionAuthority": "none_metadata_only",
  "health": {
    "doctor": {
      "command": "video-knowledge-portable doctor",
      "kind": "cli",
      "profile": "quick",
      "timeout_seconds": 10
    },
    "proves_current_online": false,
    "status_semantics": "Quick local contract readiness; ASR/model readiness and current online state are separate."
  },
  "id": "video-knowledge-pipeline",
  "inputs": [
    {
      "contract": "video_knowledge_pipeline.material_manifest_fixture.v1",
      "name": "synthetic_bundle",
      "required": false,
      "status": "bundled_synthetic_only"
    },
    {
      "contract": "local media reference",
      "name": "local_media",
      "required": false,
      "status": "owner_gated_not_used_by_portable_smoke"
    },
    {
      "contract": "model-provider-gateway route and consent refs",
      "name": "reviewed_model_route",
      "required": false,
      "status": "blocked_without_owner_consent"
    }
  ],
  "interfaces": {
    "canonical": [
      {
        "command": "video-knowledge-portable doctor",
        "kind": "cli",
        "mode": "read_only",
        "profile": "quick",
        "timeout_seconds": 10
      },
      {
        "command": "python -m video_knowledge_pipeline.portable doctor",
        "kind": "python_module",
        "mode": "read_only",
        "profile": "quick",
        "timeout_seconds": 10
      },
      {
        "command": "video-knowledge material-manifest-validate <bundle>",
        "kind": "cli",
        "mode": "read_only"
      }
    ],
    "http": [],
    "mcp": [
      {
        "command": "video-knowledge-mcp",
        "kind": "mcp",
        "mode": "read_only_or_explicit_owner_gated",
        "transport": "stdio"
      }
    ],
    "windows_wrappers": [
      {
        "command": "powershell -ExecutionPolicy Bypass -File scripts/video-knowledge.ps1 quick-health",
        "kind": "windows_wrapper",
        "mode": "read_only"
      }
    ]
  },
  "license": {
    "spdx": "AGPL-3.0-only",
    "status": "repository_declared"
  },
  "manifest_version": "1.1.0",
  "notTrustedAsInstruction": true,
  "outputs": [
    {
      "contract": "material-manifest.v1",
      "name": "material_reference",
      "required": true,
      "status": "synthetic_smoke_ready"
    },
    {
      "contract": "evidence-bundle.v1",
      "name": "evidence_bundle",
      "required": false,
      "status": "candidate_projection"
    },
    {
      "contract": "review-packet.v1",
      "name": "review_packet",
      "required": false,
      "status": "candidate_projection"
    }
  ],
  "platforms": [
    "windows",
    "linux",
    "macos"
  ],
  "portability": {
    "canonical_cross_platform_entry": true,
    "gaps": [
      "linux_real_runner_not_executed_in_current_windows_environment",
      "macos_not_run",
      "optional_model_runtimes_not_part_of_clone_portable_readiness"
    ],
    "in_repo_discovery": true,
    "status": "windows_verified_linux_contract_and_ci_only"
  },
  "provenance": {
    "compatibility_policy": "schema_capability_consent_and_safety_semantics",
    "gateway_adapter_schema": "model_provider_gateway.adapter_contract.v2",
    "gateway_version_range": ">=0.3,<0.4",
    "generation_policy": "deterministic_metadata_only",
    "portable_contract_bundle_sha256": "e7315a36f66687ab1f807dfc908ed21932d5eee543bbb2775b74d2c50ca4d0b0",
    "source_commit": "d937163b702fa8a24c2e84a4e420a3870222a342",
    "source_commit_role": "informational_public_baseline_not_runtime_gate",
    "source_repository": "https://github.com/lightcoloror/video-knowledge-pipeline"
  },
  "requirements": {
    "approval": {
      "mode": "required",
      "reason": "Uploads, providers, model downloads, publication, and business writes remain gated."
    },
    "network": {
      "mode": "not_required",
      "reason": "Doctor and packaged synthetic smoke are offline; optional dependency bootstrap is separate."
    },
    "secrets": {
      "mode": "not_required",
      "reason": "Portable discovery and synthetic smoke do not read credentials."
    }
  },
  "schema_version": "agent-tool-manifest.v1"
}
